{
  "name": "vista-del-mar-naithon",
  "steps": [
    {
      "id": "task",
      "question": "Что вы решаете этой покупкой?",
      "note": "От ответа зависит, о чём вообще имеет смысл говорить дальше: о доме или о таблице доходности.",
      "options": [
        { "id": "live", "label": "Жить самому или семьёй" },
        { "id": "both", "label": "Жить и сдавать в своё отсутствие" },
        { "id": "rent", "label": "Только сдавать" },
        { "id": "explore", "label": "Пока разбираюсь в рынке" }
      ]
    },
    {
      "id": "size",
      "question": "Сколько спален вам реально нужно?",
      "note": "В проекте три типа вилл: VX на 3 спальни, LX на 4 и LF на 5.",
      "options": [
        { "id": "vx", "label": "Три", "hint": "тип VX, 350 м² общей площади" },
        { "id": "lx", "label": "Четыре", "hint": "тип LX, 630 м²" },
        { "id": "lf", "label": "Пять", "hint": "тип LF, 630 м²" },
        { "id": "unsure", "label": "Ещё не считал" }
      ]
    },
    {
      "id": "geo",
      "question": "Найтон — это осознанный выбор?",
      "note": "Тихий пляж, инфраструктура в 20–30 минутах езды, жизнь на склоне.",
      "options": [
        { "id": "this", "label": "Да, ищу именно тихое северо-западное побережье" },
        { "id": "compare", "label": "Хочу сравнить с Банг Тао и Лагуной" },
        { "id": "any", "label": "Побережье не принципиально, важен сам дом" }
      ]
    },
    {
      "id": "budget",
      "question": "В каком коридоре вы считаете бюджет на дом?",
      "note": "Вопрос нужен, чтобы не показывать вам то, что вам не подходит. Прайс проекта запрашивается у застройщика.",
      "options": [
        { "id": "u500", "label": "До 500 000 $" },
        { "id": "500-1000", "label": "500 000 – 1 000 000 $" },
        { "id": "1000plus", "label": "От 1 000 000 $" },
        { "id": "unset", "label": "Не готов называть" }
      ]
    },
    {
      "id": "horizon",
      "question": "Как относитесь к покупке до сдачи?",
      "note": "Здесь платежи идут траншами по этапам конструктива, а не одной суммой при передаче ключей.",
      "options": [
        { "id": "offplan", "label": "Готов платить по этапам стройки" },
        { "id": "ready", "label": "Нужен готовый дом с ключами" },
        { "id": "looking", "label": "Пока просто смотрю рынок" }
      ]
    },
    {
      "id": "method",
      "question": "Как планируете вести сделку?",
      "options": [
        { "id": "onsite", "label": "Приеду на остров смотреть" },
        { "id": "remote", "label": "Удалённо, без перелёта" },
        { "id": "concierge", "label": "Через доверенного представителя" }
      ]
    }
  ],
  "routing": [
    { "route": "learn", "when": { "task": ["explore"], "horizon": ["looking"] } },
    { "route": "neighbor", "when": { "geo": ["compare"] } },
    { "route": "budget", "when": { "horizon": ["ready"] } },
    { "route": "remote", "when": { "method": ["remote"] } },
    { "route": "budget", "when": { "budget": ["u500"], "size": ["lx", "lf"] } },
    { "route": "learn", "when": { "task": ["explore"] } },
    { "route": "learn", "when": { "size": ["unsure"], "horizon": ["looking"] } }
  ],
  "fallbackRoute": "fit",
  "routes": {
    "fit": {
      "title": "Ваш сценарий ложится в этот проект",
      "body": "Соберём под ваш ответ: подходящий тип виллы, актуальную цену и статус из шахматки застройщика, полный график платежей и расчёт расходов владения под конкретную площадь. Отдельно — проект договора лизхолда, чтобы вы показали его своему юристу до резервации.",
      "ctaLabel": "Забрать подборку в Telegram"
    },
    "neighbor": {
      "title": "Сначала стоит сравнить побережья, а не виллы",
      "body": "Найтон и Банг Тао решают разные задачи. Найтон — тишина и вид ценой 20–30 минут до всего; Банг Тао — сервис в шаговой доступности ценой плотности и шума. Пока вы не выбрали уклад, сравнивать конкретные виллы рано.",
      "outboundLabel": "[ДАННЫЕ] — разбор Банг Тао на соседнем домене",
      "outboundHref": "",
      "ctaLabel": "Прислать сравнение двух побережий"
    },
    "budget": {
      "title": "Здесь честнее сузить выбор",
      "body": "Vista del Mar продаётся по графику этапов стройки, а не как готовый дом, и это отдельные виллы на 350–630 м². Если вам нужен готовый объект или коридор заметно ниже, разумнее смотреть другой формат — скажем прямо, что именно, вместо того чтобы подгонять проект под запрос.",
      "ctaLabel": "Показать, что попадает в коридор"
    },
    "learn": {
      "title": "Вы на этапе разбора — это нормально",
      "body": "Пришлём без звонков: как устроен лизхолд 30+30+30 и чем он отличается от собственности, чек-лист проверки застройщика до депозита, и разбор того, из чего складываются обещанные рынком 12–15% годовых. Когда появятся вопросы по конкретным виллам — вернётесь.",
      "ctaLabel": "Получить разбор без звонков"
    },
    "remote": {
      "title": "Сделка без перелёта: разберём порядок шагов",
      "body": "Удалённая покупка здесь упирается в два места: кто подписывает договор от вашего имени и кто физически принимает этапы стройки, к которым привязаны платежи. Пришлём порядок шагов, перечень документов и то, что придётся делать очно в любом случае. Обход ограничений мы не проектируем — эта часть идёт к независимому юристу.",
      "ctaLabel": "Разобрать удалённый сценарий"
    }
  }
}
