{
  "name": "compare-naithon-bangtao",
  "steps": [
    {
      "id": "rhythm",
      "question": "Как вы собираетесь здесь жить?",
      "note": "Побережье, удобное для зимовки, и побережье для постоянной жизни — это разные побережья.",
      "options": [
        { "id": "live", "label": "Постоянно или большую часть года" },
        { "id": "season", "label": "Сезон, три-четыре месяца" },
        { "id": "visits", "label": "Наездами, по две-три недели" },
        { "id": "rent", "label": "Сдавать, самому бывать редко" },
        { "id": "explore", "label": "Пока изучаю остров" }
      ]
    },
    {
      "id": "who",
      "question": "С кем вы будете здесь?",
      "options": [
        { "id": "solo", "label": "Один или вдвоём" },
        { "id": "school", "label": "С детьми школьного возраста", "hint": "школа задаёт маршрут каждый будний день" },
        { "id": "small", "label": "С маленькими детьми" },
        { "id": "guests", "label": "Часто приезжают гости" }
      ]
    },
    {
      "id": "walk",
      "question": "Насколько важно выйти из дома и дойти пешком до кафе и магазина?",
      "options": [
        { "id": "critical", "label": "Критично, иначе я в ловушке" },
        { "id": "nice", "label": "Хорошо бы, но переживу" },
        { "id": "no", "label": "Не важно, я всё равно за рулём" }
      ]
    },
    {
      "id": "evening",
      "question": "Вечерняя жизнь рядом — это плюс или минус?",
      "note": "Один и тот же бар в двухстах метрах кто-то считает достоинством, кто-то дефектом.",
      "options": [
        { "id": "need", "label": "Плюс, хочу чтобы было куда выйти" },
        { "id": "sometimes", "label": "Иногда пригодится, но не под окнами" },
        { "id": "disturbs", "label": "Минус, мне нужна тишина" }
      ]
    },
    {
      "id": "visit",
      "question": "Сможете приехать и проехать оба побережья?",
      "options": [
        { "id": "yes", "label": "Да, поездка планируется" },
        { "id": "remote", "label": "Нет, решаю удалённо" }
      ]
    }
  ],
  "routing": [
    { "route": "learn", "when": { "rhythm": ["explore"] } },
    { "route": "budget", "when": { "walk": ["critical"], "evening": ["disturbs"] } },
    { "route": "neighbor", "when": { "walk": ["critical"] } },
    { "route": "neighbor", "when": { "evening": ["need"] } },
    { "route": "remote", "when": { "visit": ["remote"] } }
  ],
  "fallbackRoute": "fit",
  "routes": {
    "fit": {
      "title": "По вашим ответам ближе Найтон",
      "body": "Вы готовы к тому, что за продуктами и в школу придётся ехать, и тишина для вас не бонус, а условие. Пришлём разбор Найтона: что там есть в пешей доступности на самом деле, как устроена дорога и какие форматы жилья на этом побережье встречаются. И честно отметим, где у нас пока нет проверенных данных.",
      "ctaLabel": "Забрать разбор Найтона"
    },
    "neighbor": {
      "title": "По вашим ответам ближе Банг Тао",
      "body": "Вам нужна инфраструктура в шаговой доступности и есть куда выйти вечером — это сильный аргумент против тихого побережья. Отдельного разбора Банг Тао у нас пока нет: как только появится проверенный источник, здесь будет прямая ссылка. Сейчас можем прислать список того, что стоит проверить на месте, чтобы поездка не прошла впустую.",
      "outboundLabel": "[ДАННЫЕ] — разбор Банг Тао на соседнем домене",
      "outboundHref": "",
      "ctaLabel": "Прислать чек-лист по Банг Тао"
    },
    "budget": {
      "title": "Ваши условия исключают друг друга — и это стоит признать",
      "body": "Вы хотите одновременно кафе в пешей доступности и тишину под окнами. На двух этих побережьях так не бывает: инфраструктура и тишина здесь размениваются напрямую. Выход обычно один из трёх — переехать чуть вглубь от оживлённого пляжа, согласиться на поездки, либо смотреть третье место. Разберём ваш случай и скажем, какой из трёх реалистичнее.",
      "ctaLabel": "Разобрать противоречие"
    },
    "learn": {
      "title": "Побережье выбирать рано — сначала уклад",
      "body": "Вы ещё смотрите остров целиком, и это нормальный этап. Сравнение двух районов на нём мало что даёт: пока не понятно, сколько месяцев в году вы здесь и с кем, любая таблица будет про чужую жизнь. Пришлём разбор того, как устроен северо-запад в целом и по каким пяти вопросам люди обычно и выбирают район.",
      "ctaLabel": "Получить разбор без звонков"
    },
    "remote": {
      "title": "Побережье удалённо не выбирают",
      "body": "Конкретный объект при должной проверке купить удалённо можно. А вот шум, дорогу и ощущение места по видео не передать, и именно они потом определяют, останетесь вы здесь или будете продавать через год. Если поездка невозможна в принципе, скажем прямо, что мы порекомендуем и на какой риск вы идёте.",
      "ctaLabel": "Обсудить удалённый сценарий"
    }
  }
}
